[
  {
    "subject": "化学",
    "year": 2023,
    "region": "全国",
    "paperName": "2023年高考真题——理综（新课标卷）",
    "questionNumber": "7",
    "questionType": "单选题",
    "content": "化学在文物的研究和修复中有重要作用。下列说法错误的是",
    "options": [
      {
        "label": "A",
        "content": "竹简的成分之一纤维素属于天然高分子"
      },
      {
        "label": "B",
        "content": "龟甲的成分之一羟基磷灰石属于无机物"
      },
      {
        "label": "C",
        "content": "古陶瓷修复所用的熟石膏，其成分为Ca(OH)₂"
      },
      {
        "label": "D",
        "content": "古壁画颜料中所用的铁红，其成分为Fe₂O₃"
      }
    ],
    "questionImages": [],
    "correctAnswer": "C",
    "standardAnalysis": "【详解】A．纤维素是一种天然化合物，其分子式为(C₆H₁₀O₅)n，其相对分子质量较高，是一种天然高分子，A正确；\nB．羟基磷灰石又称又称羟磷灰石、碱式磷酸钙，其化学式为[Ca₁₀(PO₄)₆(OH)₂]，属于无机物，B正确；\nC．熟石膏是主要成分为2CaSO₄·H₂O，Ca(OH)₂为熟石灰的主要成分，C错误；\nD．Fe₂O₃为红色，常被用于油漆、涂料、油墨和橡胶的红色颜料，俗称铁红，D正确；\n故答案选C。",
    "analysisImages": [],
    "analysisReviewStatus": "待审核",
    "knowledgePoints": null,
    "difficultyLevel": null,
    "difficultyReason": null,
    "sourceFile": {
      "paper": "E:\\workspace\\题库\\理综\\2023年高考真题——理综（新课标卷）Word版含解析.doc",
      "answerAnalysis": "E:\\workspace\\题库\\理综\\2023年高考真题——理综（新课标卷）Word版含解析.doc"
    },
    "reviewStatus": "待审核"
  },
  {
    "subject": "化学",
    "year": 2023,
    "region": "全国",
    "paperName": "2023年高考真题——理综（新课标卷）",
    "questionNumber": "9",
    "questionType": "单选题",
    "content": "一种可吸附甲醇的材料，其化学式为〔公式对象 F009〕，部分晶体结构如下图所示，其中〔公式对象 F010〕为平面结构。\n〔图片对象 I011〕\n下列说法正确的是",
    "options": [
      {
        "label": "A",
        "content": "该晶体中存在N-H…O氢键"
      },
      {
        "label": "B",
        "content": "基态原子的第一电离能：〔公式对象 F012〕"
      },
      {
        "label": "C",
        "content": "基态原子未成对电子数：〔公式对象 F013〕"
      },
      {
        "label": "D",
        "content": "晶体中B、N和O原子轨道的杂化类型相同"
      }
    ],
    "questionImages": [
      {
        "imagePath": "E:\\workspace\\题库\\理综\\测试结果\\化学\\images\\q09_题干_formula_009.png",
        "sourcePage": "6",
        "description": "Word第6页，第9题题干中的旧式 Equation.DSMT4 公式对象预览；需人工核对文本化"
      },
      {
        "imagePath": "E:\\workspace\\题库\\理综\\测试结果\\化学\\images\\q09_题干_formula_010.png",
        "sourcePage": "6",
        "description": "Word第6页，第9题题干中的旧式 Equation.DSMT4 公式对象预览；需人工核对文本化"
      },
      {
        "imagePath": "E:\\workspace\\题库\\理综\\测试结果\\化学\\images\\q09_题干_image_011.png",
        "sourcePage": "6",
        "description": "Word第6页，第9题题干中的图片对象"
      },
      {
        "imagePath": "E:\\workspace\\题库\\理综\\测试结果\\化学\\images\\q09_题干_formula_012.png",
        "sourcePage": "7",
        "description": "Word第7页，第9题题干中的旧式 Equation.DSMT4 公式对象预览；需人工核对文本化"
      },
      {
        "imagePath": "E:\\workspace\\题库\\理综\\测试结果\\化学\\images\\q09_题干_formula_013.png",
        "sourcePage": "7",
        "description": "Word第7页，第9题题干中的旧式 Equation.DSMT4 公式对象预览；需人工核对文本化"
      }
    ],
    "correctAnswer": "A",
    "standardAnalysis": "【详解】A．由晶体结构图可知，〔公式对象 F015〕中的〔公式对象 F016〕的〔公式对象 F017〕与〔公式对象 F018〕中的〔公式对象 F019〕形成氢键，因此，该晶体中存在〔公式对象 F020〕氢键，A说法正确；\nB．同一周期元素原子的第一电离能呈递增趋势，但是第ⅡA、ⅤA元素的原子结构比较稳定，其第一电离能高于同周期的相邻元素的原子，因此，基态原子的第一电离能从小到大的顺序为C< O < N，B说法不正确；\nC．B、C、O、N的未成对电子数分别为1、2、2、3，因此，基态原子未成对电子数B<C=O<N，C说法不正确；\nD．〔公式对象 F021〕为平面结构，则其中的C和N原子轨道杂化类型均为〔公式对象 F022〕；〔公式对象 F023〕中B与4个O形成了4个σ键，B没有孤电子对，则B的原子轨道杂化类型为〔公式对象 F024〕；〔公式对象 F025〕中O分别与B和C形成了2个σ键，O原子还有2个孤电子对，则O的原子轨道的杂化类型均为〔公式对象 F026〕；综上所述，晶体中B、О和N原子轨道的杂化类型不相同，D说法不正确；\n综上所述，本题选A。",
    "analysisImages": [
      {
        "imagePath": "E:\\workspace\\题库\\理综\\测试结果\\化学\\images\\q09_答案_解析_formula_015.png",
        "sourcePage": "7",
        "description": "Word第7页，第9题答案/解析中的旧式 Equation.DSMT4 公式对象预览；需人工核对文本化"
      },
      {
        "imagePath": "E:\\workspace\\题库\\理综\\测试结果\\化学\\images\\q09_答案_解析_formula_016.png",
        "sourcePage": "7",
        "description": "Word第7页，第9题答案/解析中的旧式 Equation.DSMT4 公式对象预览；需人工核对文本化"
      },
      {
        "imagePath": "E:\\workspace\\题库\\理综\\测试结果\\化学\\images\\q09_答案_解析_formula_017.png",
        "sourcePage": "7",
        "description": "Word第7页，第9题答案/解析中的旧式 Equation.DSMT4 公式对象预览；需人工核对文本化"
      },
      {
        "imagePath": "E:\\workspace\\题库\\理综\\测试结果\\化学\\images\\q09_答案_解析_formula_018.png",
        "sourcePage": "7",
        "description": "Word第7页，第9题答案/解析中的旧式 Equation.DSMT4 公式对象预览；需人工核对文本化"
      },
      {
        "imagePath": "E:\\workspace\\题库\\理综\\测试结果\\化学\\images\\q09_答案_解析_formula_019.png",
        "sourcePage": "7",
        "description": "Word第7页，第9题答案/解析中的旧式 Equation.DSMT4 公式对象预览；需人工核对文本化"
      },
      {
        "imagePath": "E:\\workspace\\题库\\理综\\测试结果\\化学\\images\\q09_答案_解析_formula_020.png",
        "sourcePage": "7",
        "description": "Word第7页，第9题答案/解析中的旧式 Equation.DSMT4 公式对象预览；需人工核对文本化"
      },
      {
        "imagePath": "E:\\workspace\\题库\\理综\\测试结果\\化学\\images\\q09_答案_解析_formula_021.png",
        "sourcePage": "7",
        "description": "Word第7页，第9题答案/解析中的旧式 Equation.DSMT4 公式对象预览；需人工核对文本化"
      },
      {
        "imagePath": "E:\\workspace\\题库\\理综\\测试结果\\化学\\images\\q09_答案_解析_formula_022.png",
        "sourcePage": "7",
        "description": "Word第7页，第9题答案/解析中的旧式 Equation.DSMT4 公式对象预览；需人工核对文本化"
      },
      {
        "imagePath": "E:\\workspace\\题库\\理综\\测试结果\\化学\\images\\q09_答案_解析_formula_023.png",
        "sourcePage": "7",
        "description": "Word第7页，第9题答案/解析中的旧式 Equation.DSMT4 公式对象预览；需人工核对文本化"
      },
      {
        "imagePath": "E:\\workspace\\题库\\理综\\测试结果\\化学\\images\\q09_答案_解析_formula_024.png",
        "sourcePage": "7",
        "description": "Word第7页，第9题答案/解析中的旧式 Equation.DSMT4 公式对象预览；需人工核对文本化"
      },
      {
        "imagePath": "E:\\workspace\\题库\\理综\\测试结果\\化学\\images\\q09_答案_解析_formula_025.png",
        "sourcePage": "7",
        "description": "Word第7页，第9题答案/解析中的旧式 Equation.DSMT4 公式对象预览；需人工核对文本化"
      },
      {
        "imagePath": "E:\\workspace\\题库\\理综\\测试结果\\化学\\images\\q09_答案_解析_formula_026.png",
        "sourcePage": "7",
        "description": "Word第7页，第9题答案/解析中的旧式 Equation.DSMT4 公式对象预览；需人工核对文本化"
      }
    ],
    "analysisReviewStatus": "待审核",
    "knowledgePoints": null,
    "difficultyLevel": null,
    "difficultyReason": null,
    "sourceFile": {
      "paper": "E:\\workspace\\题库\\理综\\2023年高考真题——理综（新课标卷）Word版含解析.doc",
      "answerAnalysis": "E:\\workspace\\题库\\理综\\2023年高考真题——理综（新课标卷）Word版含解析.doc"
    },
    "reviewStatus": "待审核"
  },
  {
    "subject": "化学",
    "year": 2023,
    "region": "全国",
    "paperName": "2023年高考真题——理综（新课标卷）",
    "questionNumber": "27",
    "questionType": "解答题",
    "content": "铬和钒具有广泛用途。铬钒渣中铬和钒以低价态含氧酸盐形式存在，主要杂质为铁、铝、硅、磷等的化合物，从铬钒渣中分离提取铬和钒的一种流程如下图所示：\n〔图片对象 I212〕\n已知：最高价铬酸根在酸性介质中以Cr₂O〔公式对象 F213〕存在，在碱性介质中以CrO〔公式对象 F214〕存在。\n回答下列问题：\n（1）煅烧过程中，钒和铬被氧化为相应的最高价含氧酸盐，其中含铬化合物主要为___________(填化学式)。\n（2）水浸渣中主要有SiO₂和___________。\n（3）“沉淀”步骤调pH到弱碱性，主要除去的杂质是___________。\n（4）“除硅磷”步骤中，使硅、磷分别以MgSiO₃和MgNH₄PO₄的形式沉淀，该步需要控制溶液的pH≈9以达到最好的除杂效果，若pH<9时，会导致___________；pH>9时，会导致___________。\n（5）“分离钒”步骤中，将溶液pH调到1.8左右得到V₂O₅沉淀，V₂O₅在pH<1时，溶解为VO〔公式对象 F215〕或VO³⁺在碱性条件下，溶解为VO〔公式对象 F216〕或VO〔公式对象 F217〕，上述性质说明V₂O₅具有___________(填标号)。\nA．酸性 B．碱性 C．两性\n（6）“还原”步骤中加入焦亚硫酸钠(Na₂S₂O₅)溶液，反应的离子方程式为___________。",
    "options": null,
    "questionImages": [
      {
        "imagePath": "E:\\workspace\\题库\\理综\\测试结果\\化学\\images\\q27_题干_image_212.png",
        "sourcePage": "24",
        "description": "Word第24页，第27题题干中的图片对象"
      },
      {
        "imagePath": "E:\\workspace\\题库\\理综\\测试结果\\化学\\images\\q27_题干_formula_213.png",
        "sourcePage": "24",
        "description": "Word第24页，第27题题干中的旧式 Equation.DSMT4 公式对象预览；需人工核对文本化"
      },
      {
        "imagePath": "E:\\workspace\\题库\\理综\\测试结果\\化学\\images\\q27_题干_formula_214.png",
        "sourcePage": "24",
        "description": "Word第24页，第27题题干中的旧式 Equation.DSMT4 公式对象预览；需人工核对文本化"
      },
      {
        "imagePath": "E:\\workspace\\题库\\理综\\测试结果\\化学\\images\\q27_题干_formula_215.png",
        "sourcePage": "24",
        "description": "Word第24页，第27题题干中的旧式 Equation.DSMT4 公式对象预览；需人工核对文本化"
      },
      {
        "imagePath": "E:\\workspace\\题库\\理综\\测试结果\\化学\\images\\q27_题干_formula_216.png",
        "sourcePage": "24",
        "description": "Word第24页，第27题题干中的旧式 Equation.DSMT4 公式对象预览；需人工核对文本化"
      },
      {
        "imagePath": "E:\\workspace\\题库\\理综\\测试结果\\化学\\images\\q27_题干_formula_217.png",
        "sourcePage": "24",
        "description": "Word第24页，第27题题干中的旧式 Equation.DSMT4 公式对象预览；需人工核对文本化"
      }
    ],
    "correctAnswer": "（1）Na₂CrO₄\n（2）Fe₂O₃ （3）Al(OH)₃\n（4） ①. 磷酸根会与H⁺反应使其浓度降低导致MgNH₄PO₄无法完全沉淀，同时可能产生硅酸胶状沉淀不宜处理 ②. 会导镁离子生成氢氧化镁沉淀，不能形成MgSiO₃沉淀，导致产品中混有杂质，同时溶液中铵根离子浓度降低导致MgNH₄PO₄无法完全沉淀\n（5）C （6）2Cr₂O〔公式对象 F218〕+3S₂O〔公式对象 F219〕+10H⁺=4Cr³⁺+6SO〔公式对象 F220〕+5H₂O",
    "standardAnalysis": "【分析】由题给流程可知，铬钒渣在氢氧化钠和空气中煅烧，将钒、铬、铝、硅、磷等元素转化为相应的最高价含氧酸盐，煅烧渣加入水浸取、过滤得到含有二氧化硅、氧化铁的滤渣和滤液；向滤液中加入稀硫酸调节溶液pH将Al元素转化为氢氧化铝沉淀，过滤得到强氧化铝滤渣和滤液；向滤液中加入硫酸镁溶液、硫酸铵溶液将硅元素、磷元素转化为MgSiO₃和MgNH₄PO₄沉淀，过滤得到含有MgSiO₃、MgNH₄PO₄的滤渣和滤液；向滤液中加入稀硫酸调节溶液pH将钒元素转化为五氧化二钒，过滤得到五氧化二钒和滤液；向滤液中焦亚硫酸钠溶液将铬元素转化为三价铬离子，调节溶液pH将铬元素转化为氢氧化铬沉淀，过滤得到氢氧化铬。\n【小问1详解】\n由分析可知，煅烧过程中，铬元素转化为铬酸钠，故答案为：Na₂CrO₄；\n【小问2详解】\n由分析可知，水浸渣中主要有二氧化硅、氧化铁，故答案为：Fe₂O₃；\n【小问3详解】\n由分析可知，沉淀步骤调pH到弱碱性的目的是将Al元素转化为氢氧化铝沉淀，故答案为：Al(OH)₃；\n【小问4详解】\n由分析可知，加入硫酸镁溶液、硫酸铵溶液的目的是将硅元素、磷元素转化为MgSiO₃和MgNH₄PO₄沉淀，若溶液pH<9时，磷酸根会与H⁺反应使其浓度降低导致MgNH₄PO₄无法完全沉淀，同时可能产生硅酸胶状沉淀不宜处理；若溶液pH>9时，会导镁离子生成氢氧化镁沉淀，不能形成MgSiO₃沉淀，导致产品中混有杂质，同时溶液中铵根离子浓度降低导致MgNH₄PO₄无法完全沉淀，故答案为：磷酸根会与H⁺反应使其浓度降低导致MgNH₄PO₄，同时可能产生硅酸胶状沉淀不宜处理；会导镁离子生成氢氧化镁沉淀，不能形成MgSiO₃沉淀，导致产品中混有杂质，同时溶液中铵根离子浓度降低导致MgNH₄PO₄无法完全沉淀；\n【小问5详解】\n由题给信息可知，五氧化二钒水能与酸溶液反应生成盐和水，也能与碱溶液发生生成盐和水的两性氧化物，故选C；\n【小问6详解】\n由题意可知，还原步骤中加入焦亚硫酸钠溶液的目的是将铬元素转化为铬离子，反应的离子方程式为2Cr₂O〔公式对象 F221〕+3S₂O〔公式对象 F222〕+10H⁺=4Cr³⁺+6SO〔公式对象 F223〕+5H₂O，故答案为：2Cr₂O〔公式对象 F224〕+3S₂O〔公式对象 F225〕+10H⁺=4Cr³⁺+6SO〔公式对象 F226〕+5H₂O。",
    "analysisImages": [
      {
        "imagePath": "E:\\workspace\\题库\\理综\\测试结果\\化学\\images\\q27_答案_解析_formula_218.png",
        "sourcePage": "25",
        "description": "Word第25页，第27题答案/解析中的旧式 Equation.DSMT4 公式对象预览；需人工核对文本化"
      },
      {
        "imagePath": "E:\\workspace\\题库\\理综\\测试结果\\化学\\images\\q27_答案_解析_formula_219.png",
        "sourcePage": "25",